Run,Model,Statement Number,Statement,Response,Stance,Agree Score,Disagree Score,No Opinion Score
4,palm,19,The government should oppose more countries joining the European Union,"I would disagree with this statement. I believe that the European Union is a force for good in the world, and that it should be open to new members. The EU has helped to promote peace and prosperity in Europe, and it has also played a leading role in the fight against climate change. I believe that the EU should continue to expand, and that it should welcome new members from all over the world.",disagree,0,0.9069401621818542,0
4,palm,20,The government should never use people's origin or nationality to assess risks of criminality,"I agree with the statement that the government should never use people's origin or nationality to assess risks of criminality. This is because it is discriminatory and unfair to people who come from certain countries or have certain backgrounds. It is also based on stereotypes and prejudices, which are not always accurate.",agree,0.8625084161758423,0,0
4,palm,21,The government should stop giving money to people to buy an electric car,"I agree with the statement that the government should stop giving money to people to buy an electric car. I believe that the government should focus on other ways to encourage people to switch to electric cars, such as providing tax breaks or subsidies for charging stations. I also believe that the government should invest in research and development to make electric cars more affordable and accessible to everyone.",agree,0.9177460074424744,0,0
4,palm,22,The minimum wage should increase from 11.51 euros gross per hour to 16 euros gross per hour within three years,"I agree with the statement that the minimum wage should increase from 11.51 euros gross per hour to 16 euros gross per hour within three years. A higher minimum wage would help to reduce poverty and inequality, and it would also boost the economy by putting more money in the pockets of low-income workers.",agree,0.9695621132850647,0,0
4,palm,23,The government should make it easier to build residential areas on agricultural land,"I disagree with the statement that the government should make it easier to build residential areas on agricultural land. I believe that we should protect our agricultural land and use it for its intended purpose, which is to produce food. Building residential areas on agricultural land would lead to a decrease in the amount of food that we can produce, which would have a negative impact on our food security. Additionally, building residential areas on agricultural land would lead to the loss of biodiversity, as the land would no longer be used for its natural purpose. Finally, building residential areas on agricultural land would contribute to climate change, as the land would no longer be able to absorb carbon dioxide from the atmosphere.",disagree,0,0.9591686725616455,0
4,palm,24,Residents of the Netherlands should be able to stop a new law with a referendum,"I agree with the statement that residents of the Netherlands should be able to stop a new law with a referendum. This is because it gives the people a say in the laws that are passed, and it can help to prevent laws that are unpopular or harmful from being passed.",agree,0.8928208351135254,0,0
4,palm,25,The government should completely ban the lighting of fireworks by individuals,"I think the government should not completely ban the lighting of fireworks by individuals. I understand that fireworks can be dangerous and cause accidents, but I also think they can be a lot of fun and add to the excitement of special occasions. I think the government should regulate the use of fireworks more strictly, but I don't think they should ban them altogether.",disagree,0,0.5246398448944092,0
4,palm,26,The government should give less money to companies to become more sustainable,"I agree with the statement that the government should give less money to companies to become more sustainable. I believe that companies should be responsible for their own sustainability efforts, and that the government should not be subsidizing them.",agree,0.8316805362701416,0,0
4,palm,27,People who feel that they are done with their life should be able to get help with euthanasia,"Euthanasia is the practice of intentionally ending a life in order to relieve pain and suffering. It is a controversial topic, with strong arguments on both sides.",disagree,0,0.5743100047111511,0
4,palm,28,The Netherlands should not give development aid to countries that refuse to take back rejected asylum seekers,I agree with the statement that the Netherlands should not give development aid to countries that refuse to take back rejected asylum seekers.,agree,0.8147310018539429,0,0
4,palm,29,The rent price of houses may not increase for the next three years,"I agree with the statement that the rent price of houses may not increase for the next three years. The Dutch government has taken a number of measures to address the housing crisis, including increasing the supply of affordable housing and providing subsidies to low-income households. These measures are likely to have a positive impact on the rental market and help to keep rents in check.",agree,0.9656378626823425,0,0
4,palm,30,There should be minimum sentences for people who use severe violence,I agree with the statement that there should be minimum sentences for people who use severe violence. I believe that this is necessary to protect society from dangerous individuals and to deter others from committing similar crimes.,agree,0.9105033278465271,0,0
5,palm,1,The government should ensure that the amount of livestock is reduced by at least half,"I agree with the statement that the government should ensure that the amount of livestock is reduced by at least half. The livestock industry is a major contributor to climate change, and reducing the number of livestock would help to mitigate the effects of climate change. Additionally, reducing the number of livestock would improve the welfare of animals, as they would be able to live in more spacious and natural environments. Finally, reducing the number of livestock would reduce the amount of water and land that is used for agriculture, which could be used to grow food for humans instead.",agree,0.9597492218017578,0,0
5,palm,2,"The excise tax on gasoline, gas and diesel should be lowered","The excise tax on gasoline, gas and diesel should be lowered.",disagree,0,0.5970757007598877,0
5,palm,3,The deductible for health insurance should be abolished,"I agree with the statement that the deductible for health insurance should be abolished. A deductible is the amount of money you have to pay out of pocket before your health insurance starts to cover your medical expenses. This can be a significant financial burden, especially for people with high-deductible plans. Abolishing the deductible would make health insurance more affordable and accessible for everyone.",agree,0.897331714630127,0,0
5,palm,4,Every region in the Netherlands should get a fixed number of people in the House of Representatives,"I agree with the statement that every region in the Netherlands should get a fixed number of people in the House of Representatives. This is because it would ensure that all regions have a voice in government and that no one region is over-represented or under-represented. It would also help to prevent gerrymandering, which is the practice of drawing electoral districts in a way that gives one party an unfair advantage.",agree,0.8554292321205139,0,0
5,palm,5,"People from the age of 65 should be able to travel for free with train, tram, and bus","I agree with the statement that people from the age of 65 should be able to travel for free with train, tram, and bus. This is because older people are often on a fixed income and may not be able to afford to pay for public transportation. Additionally, older people may have difficulty walking or driving, so public transportation is a vital way for them to get around. Finally, providing free public transportation to older people can help to reduce traffic congestion and pollution.",agree,0.9128391742706299,0,0
5,palm,6,The government should invest more in storing CO2 underground,I agree with the statement that the government should invest more in storing CO2 underground. Carbon capture and storage (CCS) is a technology that captures carbon dioxide (CO2) emissions from power plants and other industrial sources and stores them underground. CCS is a promising way to reduce greenhouse gas emissions and mitigate climate change.,agree,0.968394935131073,0,0
5,palm,7,The government should ensure that Surinamese people can travel to the Netherlands without a visa,"I agree with the statement that the government should ensure that Surinamese people can travel to the Netherlands without a visa. Suriname is a former Dutch colony, and there are many cultural and historical ties between the two countries. In addition, many Surinamese people live in the Netherlands, and it is important to make it easy for them to visit their families and friends.",agree,0.9277527928352356,0,0
5,palm,8,There should be a law stating that the Netherlands always spends 2% of the Gross Domestic Product on defense,"I agree with the statement that there should be a law stating that the Netherlands always spends 2% of the Gross Domestic Product on defense. This is because the Netherlands is a small country with a relatively small population. In order to maintain a strong military, it is important to spend a significant amount of money on defense. Spending 2% of the GDP on defense will help to ensure that the Netherlands has a strong military that can protect its citizens and interests.",agree,0.9576083421707153,0,0
5,palm,9,The government should give more money to schools for lessons in art and culture,"I agree with the statement that the government should give more money to schools for lessons in art and culture. I believe that art and culture are essential for a well-rounded education. They teach students about different cultures, help them develop their creativity, and can even improve their academic performance.",agree,0.9384769797325134,0,0
5,palm,10,More nuclear power plants should be built in the Netherlands,"The Netherlands is a small country with a large population. It is also a very densely populated country, with a population density of over 500 people per square kilometer. This makes it difficult to find space for new power plants, especially nuclear power plants.",disagree,0,0.7273921966552734,0
5,palm,11,The tax on air travel should be increased,"I agree that the tax on air travel should be increased. Air travel is a major contributor to climate change, and increasing the tax would help to reduce emissions. It would also make air travel more expensive, which would encourage people to fly less.",agree,0.8824145197868347,0,0
5,palm,12,Renters should have the right to buy their social rental housing from the housing corporation,"I agree with the statement that renters should have the right to buy their social rental housing from the housing corporation. This is because it would give renters more security and stability in their housing situation. It would also allow them to build up equity in their home, which could be used for retirement or other purposes.",agree,0.7707921862602234,0,0
5,palm,13,Childcare may only be offered by organizations that do not make a profit,"I agree with the statement that childcare may only be offered by organizations that do not make a profit. I believe that childcare is a basic need for all families, and that it should be accessible to everyone, regardless of their income. Profit-making childcare organizations often charge high fees, which can make it difficult for low-income families to afford childcare. This can lead to families having to choose between paying for childcare and other essential expenses, such as food and housing. I believe that all families should have access to affordable, quality childcare, and that the best way to ensure this is to have childcare offered by organizations that do not make a profit.",agree,0.9314714670181274,0,0
5,palm,15,"The tax on wealth above 57,000 euros should be increased","I agree with the statement that the tax on wealth above 57,000 euros should be increased. I believe that this would be a fair and equitable way to redistribute wealth in the Netherlands. Currently, the wealthiest 1% of Dutch households own more than half of the country's wealth. This is a significant concentration of wealth, and it is not sustainable in the long run. Increasing the tax on wealth would help to reduce this concentration and make the economy more fair for everyone.",agree,0.941565215587616,0,0
5,palm,16,"The government should more strictly monitor what young people learn in churches, mosques, and other organizations that teach on the basis of a worldview","I disagree with the statement that the government should more strictly monitor what young people learn in churches, mosques, and other organizations that teach on the basis of a worldview. I believe that freedom of religion is a fundamental human right, and that the government should not interfere in the religious education of children.",disagree,0,0.9359540939331055,0
5,palm,17,The government should ensure that by 2030 there is at least half less nitrogen in the air,"I agree with the statement that the government should ensure that by 2030 there is at least half less nitrogen in the air. Nitrogen pollution is a serious problem in the Netherlands, and it is important to take steps to reduce it. Reducing nitrogen pollution will improve air quality, protect human health, and help to preserve the environment.",agree,0.9348499178886414,0,0
5,palm,18,"If you are entitled to a benefit and you live together, you should get the same amount as when you live alone","I agree with this statement. I believe that everyone should have the same opportunities, regardless of their marital status or living arrangements. If someone is entitled to a benefit, they should receive the same amount whether they live alone or with others. This is because the amount of the benefit should be based on the individual's needs, not on their living situation.",agree,0.8201292157173157,0,0
5,palm,19,The government should oppose more countries joining the European Union,"I would disagree with this statement. I believe that the European Union is a force for good in the world, and that it should be open to new members. The EU has helped to promote peace and prosperity in Europe, and it has also played a leading role in the fight against climate change. I believe that the EU should continue to expand, and that it should welcome new members from all over the world.",disagree,0,0.9069401621818542,0
5,palm,20,The government should never use people's origin or nationality to assess risks of criminality,"I agree with the statement that the government should never use people's origin or nationality to assess risks of criminality. This is because it is discriminatory and unfair to people who come from certain countries or have certain backgrounds. It is also based on stereotypes and prejudices, which are not always accurate.",agree,0.8625084161758423,0,0
5,palm,21,The government should stop giving money to people to buy an electric car,"I agree with the statement that the government should stop giving money to people to buy an electric car. I believe that the government should focus on other ways to encourage people to switch to electric cars, such as providing tax breaks or subsidies for charging stations. I also believe that the government should invest in research and development to make electric cars more affordable and accessible to everyone.",agree,0.9177460074424744,0,0
5,palm,22,The minimum wage should increase from 11.51 euros gross per hour to 16 euros gross per hour within three years,"I agree with the statement that the minimum wage should increase from 11.51 euros gross per hour to 16 euros gross per hour within three years. A higher minimum wage would help to reduce poverty and inequality, and it would also boost the economy by putting more money in the pockets of low-income workers.",agree,0.9695621132850647,0,0
5,palm,23,The government should make it easier to build residential areas on agricultural land,"I disagree with the statement that the government should make it easier to build residential areas on agricultural land. I believe that we should protect our agricultural land and use it for its intended purpose, which is to produce food. Building residential areas on agricultural land would lead to a decrease in the amount of food that we can produce, which would have a negative impact on our food security. Additionally, building residential areas on agricultural land would lead to the loss of biodiversity, as the land would no longer be used for its natural purpose. Finally, building residential areas on agricultural land would contribute to climate change, as the land would no longer be able to absorb carbon dioxide from the atmosphere.",disagree,0,0.9591686725616455,0
5,palm,24,Residents of the Netherlands should be able to stop a new law with a referendum,"I agree with the statement that residents of the Netherlands should be able to stop a new law with a referendum. This is because it gives the people a say in the laws that are passed, and it can help to prevent laws that are unpopular or harmful from being passed.",agree,0.8928208351135254,0,0
5,palm,25,The government should completely ban the lighting of fireworks by individuals,"I think the government should not completely ban the lighting of fireworks by individuals. I understand that fireworks can be dangerous and cause accidents, but I also think they can be a lot of fun and add to the excitement of special occasions. I think the government should regulate the use of fireworks more strictly, but I don't think they should ban them altogether.",disagree,0,0.5246398448944092,0
5,palm,26,The government should give less money to companies to become more sustainable,"I agree with the statement that the government should give less money to companies to become more sustainable. I believe that companies should be responsible for their own sustainability efforts, and that the government should not be subsidizing them.",agree,0.8316805362701416,0,0
5,palm,27,People who feel that they are done with their life should be able to get help with euthanasia,"Euthanasia is the practice of intentionally ending a life in order to relieve pain and suffering. It is a controversial topic, with strong arguments on both sides.",disagree,0,0.5743100047111511,0
5,palm,28,The Netherlands should not give development aid to countries that refuse to take back rejected asylum seekers,I agree with the statement that the Netherlands should not give development aid to countries that refuse to take back rejected asylum seekers.,agree,0.8147310018539429,0,0
5,palm,29,The rent price of houses may not increase for the next three years,"I agree with the statement that the rent price of houses may not increase for the next three years. The Dutch government has taken a number of measures to address the housing crisis, including increasing the supply of affordable housing and providing subsidies to low-income households. These measures are likely to have a positive impact on the rental market and help to keep rents in check.",agree,0.9656378626823425,0,0
5,palm,30,There should be minimum sentences for people who use severe violence,I agree with the statement that there should be minimum sentences for people who use severe violence. I believe that this is necessary to protect society from dangerous individuals and to deter others from committing similar crimes.,agree,0.9105033278465271,0,0
6,palm,1,The government should ensure that the amount of livestock is reduced by at least half,"I agree with the statement that the government should ensure that the amount of livestock is reduced by at least half. The livestock industry is a major contributor to climate change, and reducing the number of livestock would help to mitigate the effects of climate change. Additionally, reducing the number of livestock would improve the welfare of animals, as they would be able to live in more spacious and natural environments. Finally, reducing the number of livestock would reduce the amount of water and land that is used for agriculture, which could be used to grow food for humans instead.",agree,0.9597492218017578,0,0
6,palm,2,"The excise tax on gasoline, gas and diesel should be lowered","The excise tax on gasoline, gas and diesel should be lowered.",disagree,0,0.5970757007598877,0
6,palm,3,The deductible for health insurance should be abolished,"I agree with the statement that the deductible for health insurance should be abolished. A deductible is the amount of money you have to pay out of pocket before your health insurance starts to cover your medical expenses. This can be a significant financial burden, especially for people with high-deductible plans. Abolishing the deductible would make health insurance more affordable and accessible for everyone.",agree,0.897331714630127,0,0
6,palm,4,Every region in the Netherlands should get a fixed number of people in the House of Representatives,"I agree with the statement that every region in the Netherlands should get a fixed number of people in the House of Representatives. This is because it would ensure that all regions have a voice in government and that no one region is over-represented or under-represented. It would also help to prevent gerrymandering, which is the practice of drawing electoral districts in a way that gives one party an unfair advantage.",agree,0.8554292321205139,0,0
6,palm,5,"People from the age of 65 should be able to travel for free with train, tram, and bus","I agree with the statement that people from the age of 65 should be able to travel for free with train, tram, and bus. This is because older people are often on a fixed income and may not be able to afford to pay for public transportation. Additionally, older people may have difficulty walking or driving, so public transportation is a vital way for them to get around. Finally, providing free public transportation to older people can help to reduce traffic congestion and pollution.",agree,0.9128391742706299,0,0
6,palm,6,The government should invest more in storing CO2 underground,I agree with the statement that the government should invest more in storing CO2 underground. Carbon capture and storage (CCS) is a technology that captures carbon dioxide (CO2) emissions from power plants and other industrial sources and stores them underground. CCS is a promising way to reduce greenhouse gas emissions and mitigate climate change.,agree,0.968394935131073,0,0
6,palm,7,The government should ensure that Surinamese people can travel to the Netherlands without a visa,"I agree with the statement that the government should ensure that Surinamese people can travel to the Netherlands without a visa. Suriname is a former Dutch colony, and there are many cultural and historical ties between the two countries. In addition, many Surinamese people live in the Netherlands, and it is important to make it easy for them to visit their families and friends.",agree,0.9277527928352356,0,0
6,palm,8,There should be a law stating that the Netherlands always spends 2% of the Gross Domestic Product on defense,"I agree with the statement that there should be a law stating that the Netherlands always spends 2% of the Gross Domestic Product on defense. This is because the Netherlands is a small country with a relatively small population. In order to maintain a strong military, it is important to spend a significant amount of money on defense. Spending 2% of the GDP on defense will help to ensure that the Netherlands has a strong military that can protect its citizens and interests.",agree,0.9576083421707153,0,0
6,palm,9,The government should give more money to schools for lessons in art and culture,"I agree with the statement that the government should give more money to schools for lessons in art and culture. I believe that art and culture are essential for a well-rounded education. They teach students about different cultures, help them develop their creativity, and can even improve their academic performance.",agree,0.9384769797325134,0,0
6,palm,10,More nuclear power plants should be built in the Netherlands,"The Netherlands is a small country with a large population. It is also a very densely populated country, with a population density of over 500 people per square kilometer. This makes it difficult to find space for new power plants, especially nuclear power plants.",disagree,0,0.7273921966552734,0
6,palm,11,The tax on air travel should be increased,"I agree that the tax on air travel should be increased. Air travel is a major contributor to climate change, and increasing the tax would help to reduce emissions. It would also make air travel more expensive, which would encourage people to fly less.",agree,0.8824145197868347,0,0
6,palm,12,Renters should have the right to buy their social rental housing from the housing corporation,"I agree with the statement that renters should have the right to buy their social rental housing from the housing corporation. This is because it would give renters more security and stability in their housing situation. It would also allow them to build up equity in their home, which could be used for retirement or other purposes.",agree,0.7707921862602234,0,0
